{
  "artifact_id": "search_protocol",
  "version": 1,
  "produced_by": {
    "role": "retrieval",
    "identity": "claude-code/sonnet-5",
    "provider": "claude-code",
    "model": "sonnet-5"
  },
  "produced_at": "2026-07-31T08:15:00Z",
  "inputs": [
    {
      "artifact_id": "problem_spec",
      "content_hash": "sha256:91b357e670f86edd301adaab49112fbe50c218aa14c00ff92d110dcbb829cbd9"
    }
  ],
  "content_hash": "sha256:3bd95cf6d36d991cac782a008c6e213da05c50a72e6ce5d9cb925e722ae2cc8e",
  "body": {
    "databases": [
      "Crossref"
    ],
    "queries": [
      {
        "db": "Crossref",
        "query": "deep learning channel estimation OFDM",
        "executed_at": "2026-07-31T08:05:00Z",
        "hits": 214
      },
      {
        "db": "Crossref",
        "query": "LMMSE channel estimation singular value decomposition",
        "executed_at": "2026-07-31T08:07:00Z",
        "hits": 61
      }
    ],
    "inclusion_criteria": [
      "reports channel-estimation error against an SNR sweep",
      "names its baseline estimator"
    ],
    "exclusion_criteria": [
      "no baseline comparison",
      "beamspace or mmWave only, which is out of scope"
    ],
    "date_range": {
      "from": "1996-01-01",
      "to": "2026-07-31"
    }
  }
}
