{
  "artifact_id": "statistical_report",
  "version": 1,
  "produced_by": {
    "role": "verification",
    "identity": "codex/gpt-5.6",
    "provider": "codex",
    "model": "gpt-5.6"
  },
  "produced_at": "2026-07-31T12:20:00Z",
  "inputs": [
    {
      "artifact_id": "raw_results",
      "content_hash": "sha256:df133a26c1fb0cf894525b2792682506fcc88a87dd33b15f8a46665306a7ace9"
    },
    {
      "artifact_id": "run_manifest",
      "content_hash": "sha256:687b3c40293e2b259d30f544ddcce15668d4d6c897c81f8734c2fa8af14866dd"
    },
    {
      "artifact_id": "frozen_protocol",
      "content_hash": "sha256:2d32def4dd5dc1a9980fc233d7ce9a0e4228d16db5592b9d4d0a60b808c3e84d"
    }
  ],
  "content_hash": "sha256:54a9b4caecba712a9b64079bf52c971337b5634b7bb9c10fdd5cb3dd4ea8ca5c",
  "body": {
    "estimates": [
      {
        "result_id": "r-01",
        "metric": "mse_gain_db_at_minus10dB",
        "estimate": 2.092,
        "ci_lower": 1.433,
        "ci_upper": 2.716,
        "ci_level": 0.95,
        "n": 20,
        "p_value": 2.48e-05,
        "p_adjusted": 2.48e-05,
        "method": "paired per-seed difference; percentile bootstrap, 5000 draws, seed 20260731; p from an exact two-sided sign-flip permutation test over all 2^20 sign assignments; p_adjusted by Holm across the three registered low-SNR points",
        "assumptions_checked": [
          {
            "name": "seed-matched pairing",
            "passed": true
          },
          {
            "name": "finite variance",
            "passed": true
          }
        ]
      },
      {
        "result_id": "r-02",
        "metric": "mse_gain_db_at_minus5dB",
        "estimate": 4.611,
        "ci_lower": 3.929,
        "ci_upper": 5.275,
        "ci_level": 0.95,
        "n": 20,
        "p_value": 1.91e-06,
        "p_adjusted": 5.72e-06,
        "method": "paired per-seed difference; percentile bootstrap, 5000 draws, seed 20260731; p from an exact two-sided sign-flip permutation test over all 2^20 sign assignments; p_adjusted by Holm across the three registered low-SNR points",
        "assumptions_checked": [
          {
            "name": "seed-matched pairing",
            "passed": true
          },
          {
            "name": "finite variance",
            "passed": true
          }
        ]
      },
      {
        "result_id": "r-03",
        "metric": "mse_gain_db_at_0dB",
        "estimate": 6.492,
        "ci_lower": 5.812,
        "ci_upper": 7.163,
        "ci_level": 0.95,
        "n": 20,
        "p_value": 1.91e-06,
        "p_adjusted": 5.72e-06,
        "method": "paired per-seed difference; percentile bootstrap, 5000 draws, seed 20260731; p from an exact two-sided sign-flip permutation test over all 2^20 sign assignments; p_adjusted by Holm across the three registered low-SNR points",
        "assumptions_checked": [
          {
            "name": "seed-matched pairing",
            "passed": true
          },
          {
            "name": "finite variance",
            "passed": true
          }
        ]
      }
    ],
    "multiplicity_correction": "Holm step-down across the three registered low-SNR points (-10, -5, 0 dB), applied to the permutation p-values. The reported intervals are unadjusted.",
    "effect_sizes": [
      {
        "result_id": "r-01",
        "name": "mean_gain_db",
        "value": 2.092
      },
      {
        "result_id": "r-02",
        "name": "mean_gain_db",
        "value": 4.611
      },
      {
        "result_id": "r-03",
        "name": "mean_gain_db",
        "value": 6.492
      }
    ]
  }
}
