{
  "artifact_id": "verification_report",
  "version": 1,
  "produced_by": {
    "role": "verification",
    "identity": "codex/gpt-5.6",
    "provider": "codex",
    "model": "gpt-5.6"
  },
  "produced_at": "2026-07-31T12:40:00Z",
  "inputs": [
    {
      "artifact_id": "reproduction_report",
      "content_hash": "sha256:8685526887eea0b60d49290eee4588116514f56b070ea0785cf69103c2113142"
    },
    {
      "artifact_id": "statistical_report",
      "content_hash": "sha256:54a9b4caecba712a9b64079bf52c971337b5634b7bb9c10fdd5cb3dd4ea8ca5c"
    },
    {
      "artifact_id": "raw_results",
      "content_hash": "sha256:df133a26c1fb0cf894525b2792682506fcc88a87dd33b15f8a46665306a7ace9"
    }
  ],
  "content_hash": "sha256:d2aa42e4650ec496368c6049766f076dbb901b401d89e2e9949f49cde9eb56c8",
  "body": {
    "findings": [
      {
        "finding_id": "f-01",
        "severity": "major",
        "text": "Hypothesis h-02 is not supported. The mean gain is 2.092 dB at -10 dB but 8.994 dB at +10 dB, so the advantage is smallest, not largest, at the lowest SNR."
      },
      {
        "finding_id": "f-02",
        "severity": "minor",
        "text": "The LMMSE baseline is a scalar Wiener shrinkage, not a full-covariance LMMSE. A full-covariance baseline would narrow the reported gap."
      },
      {
        "finding_id": "f-03",
        "severity": "info",
        "text": "All three low-SNR intervals exclude zero, and the exact sign-flip permutation p-values remain below 1e-04 after Holm correction across the three registered points."
      }
    ],
    "uncertainty": [
      "Per-seed variability is the dominant source of spread at every SNR point.",
      "The bootstrap is a percentile bootstrap over 20 paired differences; coverage at n=20 is approximate. The p-values are exact enumerations and carry no such caveat."
    ],
    "failures": {
      "total": 0,
      "accounted": 0
    },
    "limitations": [
      "Synthetic exponentially decaying Rayleigh channels only; no measured channels.",
      "The baseline is scalar-Wiener LMMSE, which is weaker than full-covariance LMMSE.",
      "Claim c-03 concerns the trend direction across SNR and is stated only for the grid points that were run.",
      "The estimator labelled learned is a tuned delay-domain filter, not a trained neural network; the result bounds the structure, not the architecture."
    ],
    "recommendations": [
      "Add a full-covariance LMMSE baseline before claiming a general advantage.",
      "Extend the SNR grid below -10 dB to locate where the gain collapses."
    ],
    "denominators": [
      {
        "name": "completed runs",
        "numerator": 20,
        "denominator": 20
      },
      {
        "name": "SNR points reported",
        "numerator": 3,
        "denominator": 5
      },
      {
        "name": "hypotheses supported",
        "numerator": 1,
        "denominator": 2
      }
    ]
  }
}
