{
  "artifact_id": "frozen_protocol",
  "version": 1,
  "produced_by": {
    "role": "planning",
    "identity": "claude-code/opus-5",
    "provider": "claude-code",
    "model": "opus-5"
  },
  "produced_at": "2026-07-31T10:00:00Z",
  "inputs": [
    {
      "artifact_id": "design_protocol",
      "content_hash": "sha256:d90be19c1dcf4be9c04cd4e5dd33f22670270f1a4db89e764e09a83e61f8c0f9"
    },
    {
      "artifact_id": "governance_record",
      "content_hash": "sha256:3ff6284908d40868825370ab23c542b15a6edb263ae6c7b493962fb8e38d0e1d"
    }
  ],
  "content_hash": "sha256:1e91e31a39d49b42bdb7a88eaca416ec71d3f18091f6b910b6128367f94aed5f",
  "body": {
    "frozen_at": "2026-07-31T10:00:00Z",
    "approved_by": "H. U. Yildiz",
    "hypotheses": [
      "h-01",
      "h-02"
    ],
    "outcomes": [
      {
        "metric": "mse",
        "direction": "lower_is_better",
        "threshold": null
      },
      {
        "metric": "mse_gain_db",
        "direction": "higher_is_better",
        "threshold": 0.0
      }
    ],
    "exclusions": [
      "any run whose estimator returns a non-finite MSE"
    ],
    "analysis_plan": "For each SNR point, take the per-seed paired difference 10*log10(mse_lmmse/mse_learned) and report its mean with a percentile bootstrap 95 percent interval.",
    "multiplicity_plan": "Holm correction across the three low-SNR points -10, -5 and 0 dB.",
    "stopping_rule": "Fixed 20 replications. No interim look, no extension.",
    "replications": 20,
    "seeds": [
      41,
      42,
      43,
      44,
      45,
      46,
      47,
      48,
      49,
      50,
      51,
      52,
      53,
      54,
      55,
      56,
      57,
      58,
      59,
      60
    ],
    "data_access": "generated locally by example-run/code/estimator_bench.py",
    "compute_authorisation": "self, single workstation"
  }
}
