{
  "artifact_id": "reproduction_report",
  "version": 1,
  "produced_by": {
    "role": "verification",
    "identity": "codex/gpt-5.6",
    "provider": "codex",
    "model": "gpt-5.6"
  },
  "produced_at": "2026-07-31T12:00:00Z",
  "inputs": [
    {
      "artifact_id": "run_manifest",
      "content_hash": "sha256:78c1cefbe4d2410f00b72a991f55ab0b2d1189a164e2693a70d000971feb6d0b"
    },
    {
      "artifact_id": "raw_results",
      "content_hash": "sha256:8e9e0771dea0a422d890ce451a83e73692e37aabcc70242688d509cefbe0d314"
    },
    {
      "artifact_id": "code_commit",
      "content_hash": "sha256:7d5f12e761b9255d33d0abb8adb9b3abc2cf593f8f092ad8aa3573fc3a75dcc3"
    },
    {
      "artifact_id": "environment_lock",
      "content_hash": "sha256:d3613723e6a1c07adfb605601058d74ea074e325e58c32d53ac7ccd255c0d4f5"
    }
  ],
  "content_hash": "sha256:25b28d7643501b75b58bd010ca112c9748a620a8b1e275a751ea978c30e7cebc",
  "body": {
    "reproduced": [
      {
        "run_id": "run_041",
        "original_sha256": "ad59c0bb125d02750046e27b684f9e5df478200420a20c08f174c935c69210c7",
        "reproduced_sha256": "ad59c0bb125d02750046e27b684f9e5df478200420a20c08f174c935c69210c7",
        "match": true
      },
      {
        "run_id": "run_042",
        "original_sha256": "ad59c0bb125d02750046e27b684f9e5df478200420a20c08f174c935c69210c7",
        "reproduced_sha256": "ad59c0bb125d02750046e27b684f9e5df478200420a20c08f174c935c69210c7",
        "match": true
      },
      {
        "run_id": "run_043",
        "original_sha256": "ad59c0bb125d02750046e27b684f9e5df478200420a20c08f174c935c69210c7",
        "reproduced_sha256": "ad59c0bb125d02750046e27b684f9e5df478200420a20c08f174c935c69210c7",
        "match": true
      },
      {
        "run_id": "run_044",
        "original_sha256": "ad59c0bb125d02750046e27b684f9e5df478200420a20c08f174c935c69210c7",
        "reproduced_sha256": "ad59c0bb125d02750046e27b684f9e5df478200420a20c08f174c935c69210c7",
        "match": true
      },
      {
        "run_id": "run_045",
        "original_sha256": "ad59c0bb125d02750046e27b684f9e5df478200420a20c08f174c935c69210c7",
        "reproduced_sha256": "ad59c0bb125d02750046e27b684f9e5df478200420a20c08f174c935c69210c7",
        "match": true
      }
    ],
    "environment_match": true,
    "reproduction_rate": 1.0,
    "notes": [
      "Re-executed the entrypoint from a clean directory; the output file digest was identical.",
      "Only the first five seeds are listed individually; the whole-file digest covers all 20."
    ]
  }
}
