{
  "artifact_id": "evidence_matrix",
  "version": 1,
  "produced_by": {
    "role": "retrieval",
    "identity": "claude-code/sonnet-5",
    "provider": "claude-code",
    "model": "sonnet-5"
  },
  "produced_at": "2026-07-31T08:40:00Z",
  "inputs": [
    {
      "artifact_id": "corpus_snapshot",
      "content_hash": "sha256:84d3a4c3d68324ce36ce4af47cc34efde4e45d0ef280d67a99682c19a5f2cc10"
    },
    {
      "artifact_id": "kg_snapshot",
      "content_hash": "sha256:06cf12e59c233f528bba507bfe9a63b2d6a9c00e83f4844b8a3acc46620e9d2e"
    },
    {
      "artifact_id": "search_protocol",
      "content_hash": "sha256:3bd95cf6d36d991cac782a008c6e213da05c50a72e6ce5d9cb925e722ae2cc8e"
    }
  ],
  "content_hash": "sha256:aba7f1d3513f1abb94dd7a0072fb3cae8dc8cf2a306e1a922119f2a05b7a6a90",
  "body": {
    "rows": [
      {
        "claim_id": "c-01",
        "source_id": "s-01",
        "locator": {
          "kind": "section",
          "value": "IV-A"
        },
        "method": "simulation, OFDM pilot-aided estimation",
        "result": "a learned estimator lowers MSE relative to the reported baseline",
        "strength": "moderate",
        "contradiction_of": []
      },
      {
        "claim_id": "c-02",
        "source_id": "s-02",
        "locator": {
          "kind": "figure",
          "value": "Fig. 2"
        },
        "method": "simulation over an SNR sweep",
        "result": "the learned advantage persists across the reported SNR range",
        "strength": "moderate",
        "contradiction_of": []
      },
      {
        "claim_id": "c-03",
        "source_id": "s-03",
        "locator": {
          "kind": "section",
          "value": "II"
        },
        "method": "analytical derivation",
        "result": "LMMSE with the true correlation matrix is the minimum-MSE linear estimator",
        "strength": "strong",
        "contradiction_of": [
          "c-01"
        ]
      },
      {
        "claim_id": "c-04",
        "source_id": "s-03",
        "locator": {
          "kind": "section",
          "value": "III-B"
        },
        "method": "analytical derivation",
        "result": "rank reduction in the delay domain retains nearly all channel energy",
        "strength": "strong",
        "contradiction_of": []
      },
      {
        "claim_id": "c-05",
        "source_id": "s-04",
        "locator": {
          "kind": "figure",
          "value": "Fig. 3"
        },
        "method": "simulation, single configuration",
        "result": "the reported curve carries no uncertainty interval and no replication count",
        "strength": "weak",
        "contradiction_of": []
      }
    ],
    "gaps": [
      {
        "description": "No source in the corpus reports a seed-matched paired comparison with an uncertainty interval.",
        "blocking": false
      },
      {
        "description": "No source states whether its LMMSE baseline used the true channel correlation matrix.",
        "blocking": false
      }
    ]
  }
}
