{
  "artifact_id": "claim_evidence_map",
  "version": 1,
  "produced_by": {
    "role": "synthesis",
    "identity": "claude-code/fable-5",
    "provider": "claude-code",
    "model": "fable-5"
  },
  "produced_at": "2026-07-31T13:30:00Z",
  "inputs": [
    {
      "artifact_id": "statistical_report",
      "content_hash": "sha256:413254fdc02c56dfc69499b4fdc77191edb09bc426e41075d0f666a01b971171"
    },
    {
      "artifact_id": "verification_report",
      "content_hash": "sha256:700e7a3118cefa77d529134483f1a502f4af46cb9328887e54aa0fcfa00b5f5c"
    },
    {
      "artifact_id": "corpus_snapshot",
      "content_hash": "sha256:84d3a4c3d68324ce36ce4af47cc34efde4e45d0ef280d67a99682c19a5f2cc10"
    },
    {
      "artifact_id": "figure_registry",
      "content_hash": "sha256:b1539ec6e68de4ac83c003f2d01685a62e926a37f4bb6783049afdc5670c0f29"
    }
  ],
  "content_hash": "sha256:05956a7bee8d5210eaabd426d57e8e06e8dc09045d30fd7854962ef3936d7f7d",
  "body": {
    "claims": [
      {
        "claim_id": "c-01",
        "text": "At -10 dB SNR the learned estimator lowers MSE by 2.092 dB relative to scalar-Wiener LMMSE (95% CI [1.433, 2.716], n=20).",
        "location": {
          "file": "manuscript.md",
          "section": "Results"
        },
        "supported_by": {
          "result_ids": [
            "r-01"
          ],
          "source_ids": []
        },
        "scope": "within_evidence"
      },
      {
        "claim_id": "c-02",
        "text": "At 0 dB SNR the gain is 6.492 dB (95% CI [5.812, 7.163], n=20).",
        "location": {
          "file": "manuscript.md",
          "section": "Results"
        },
        "supported_by": {
          "result_ids": [
            "r-03"
          ],
          "source_ids": []
        },
        "scope": "within_evidence"
      },
      {
        "claim_id": "c-03",
        "text": "Across the grid that was run, the advantage grows with SNR rather than shrinking, so the hypothesis that it peaks at low SNR is not supported.",
        "location": {
          "file": "manuscript.md",
          "section": "Results"
        },
        "supported_by": {
          "result_ids": [
            "r-01",
            "r-02",
            "r-03"
          ],
          "source_ids": []
        },
        "scope": "extrapolation"
      },
      {
        "claim_id": "c-04",
        "text": "The classical LMMSE estimator is the minimum-MSE linear estimator when the true channel correlation matrix is available.",
        "location": {
          "file": "manuscript.md",
          "section": "Method"
        },
        "supported_by": {
          "result_ids": [],
          "source_ids": [
            "s-03"
          ]
        },
        "scope": "within_evidence"
      }
    ]
  }
}
