{
  "artifact_id": "hypothesis_registry",
  "version": 1,
  "produced_by": {
    "role": "planning",
    "identity": "claude-code/opus-5",
    "provider": "claude-code",
    "model": "opus-5"
  },
  "produced_at": "2026-07-31T09:10:00Z",
  "inputs": [
    {
      "artifact_id": "evidence_matrix",
      "content_hash": "sha256:aba7f1d3513f1abb94dd7a0072fb3cae8dc8cf2a306e1a922119f2a05b7a6a90"
    }
  ],
  "content_hash": "sha256:dfe5c32218dd9f3fd584723d1783468c7820871cad9847a7e813ffc39292cce6",
  "body": {
    "hypotheses": [
      {
        "hypothesis_id": "h-01",
        "statement": "A delay-domain learned estimator attains lower MSE than a scalar-Wiener LMMSE estimator at SNR values at or below 0 dB.",
        "falsifiable_prediction": "The paired per-seed MSE gain in dB at -10, -5 and 0 dB has a 95 percent interval that excludes zero.",
        "novelty_status": "replication",
        "feasibility": "high",
        "discriminating_evidence": [
          "c-01",
          "c-03",
          "c-04"
        ],
        "decision": "accepted"
      },
      {
        "hypothesis_id": "h-02",
        "statement": "The learned advantage is largest at the lowest SNR.",
        "falsifiable_prediction": "The mean gain at -10 dB exceeds the mean gain at +10 dB.",
        "novelty_status": "novel",
        "feasibility": "high",
        "discriminating_evidence": [
          "c-02"
        ],
        "decision": "accepted"
      }
    ]
  }
}
