{
  "artifact_id": "run_manifest",
  "version": 1,
  "produced_by": {
    "role": "execution",
    "identity": "claude-code/sonnet-5",
    "provider": "claude-code",
    "model": "sonnet-5"
  },
  "produced_at": "2026-07-31T11:10:00Z",
  "inputs": [
    {
      "artifact_id": "code_commit",
      "content_hash": "sha256:7d5f12e761b9255d33d0abb8adb9b3abc2cf593f8f092ad8aa3573fc3a75dcc3"
    },
    {
      "artifact_id": "environment_lock",
      "content_hash": "sha256:d3613723e6a1c07adfb605601058d74ea074e325e58c32d53ac7ccd255c0d4f5"
    },
    {
      "artifact_id": "data_manifest",
      "content_hash": "sha256:e9c56c7700b51710ce4e0531a274eb3569d5aa2987f85b65481a5e862e8031c1"
    }
  ],
  "content_hash": "sha256:78c1cefbe4d2410f00b72a991f55ab0b2d1189a164e2693a70d000971feb6d0b",
  "body": {
    "replications": 20,
    "seeds": [
      41,
      42,
      43,
      44,
      45,
      46,
      47,
      48,
      49,
      50,
      51,
      52,
      53,
      54,
      55,
      56,
      57,
      58,
      59,
      60
    ],
    "runs": [
      {
        "run_id": "run_041",
        "seed": 41,
        "config_sha256": "8a35ef5f6bc1530ace1fa621ca59cceb3d05740500a04fb4db58b050d76e1a74",
        "started_at": "2026-07-31T11:00:00Z",
        "finished_at": "2026-07-31T11:00:01Z",
        "status": "ok"
      },
      {
        "run_id": "run_042",
        "seed": 42,
        "config_sha256": "8a35ef5f6bc1530ace1fa621ca59cceb3d05740500a04fb4db58b050d76e1a74",
        "started_at": "2026-07-31T11:00:10Z",
        "finished_at": "2026-07-31T11:00:11Z",
        "status": "ok"
      },
      {
        "run_id": "run_043",
        "seed": 43,
        "config_sha256": "8a35ef5f6bc1530ace1fa621ca59cceb3d05740500a04fb4db58b050d76e1a74",
        "started_at": "2026-07-31T11:00:20Z",
        "finished_at": "2026-07-31T11:00:21Z",
        "status": "ok"
      },
      {
        "run_id": "run_044",
        "seed": 44,
        "config_sha256": "8a35ef5f6bc1530ace1fa621ca59cceb3d05740500a04fb4db58b050d76e1a74",
        "started_at": "2026-07-31T11:00:30Z",
        "finished_at": "2026-07-31T11:00:31Z",
        "status": "ok"
      },
      {
        "run_id": "run_045",
        "seed": 45,
        "config_sha256": "8a35ef5f6bc1530ace1fa621ca59cceb3d05740500a04fb4db58b050d76e1a74",
        "started_at": "2026-07-31T11:00:40Z",
        "finished_at": "2026-07-31T11:00:41Z",
        "status": "ok"
      },
      {
        "run_id": "run_046",
        "seed": 46,
        "config_sha256": "8a35ef5f6bc1530ace1fa621ca59cceb3d05740500a04fb4db58b050d76e1a74",
        "started_at": "2026-07-31T11:00:50Z",
        "finished_at": "2026-07-31T11:00:51Z",
        "status": "ok"
      },
      {
        "run_id": "run_047",
        "seed": 47,
        "config_sha256": "8a35ef5f6bc1530ace1fa621ca59cceb3d05740500a04fb4db58b050d76e1a74",
        "started_at": "2026-07-31T11:00:60Z",
        "finished_at": "2026-07-31T11:00:61Z",
        "status": "ok"
      },
      {
        "run_id": "run_048",
        "seed": 48,
        "config_sha256": "8a35ef5f6bc1530ace1fa621ca59cceb3d05740500a04fb4db58b050d76e1a74",
        "started_at": "2026-07-31T11:00:70Z",
        "finished_at": "2026-07-31T11:00:71Z",
        "status": "ok"
      },
      {
        "run_id": "run_049",
        "seed": 49,
        "config_sha256": "8a35ef5f6bc1530ace1fa621ca59cceb3d05740500a04fb4db58b050d76e1a74",
        "started_at": "2026-07-31T11:00:80Z",
        "finished_at": "2026-07-31T11:00:81Z",
        "status": "ok"
      },
      {
        "run_id": "run_050",
        "seed": 50,
        "config_sha256": "8a35ef5f6bc1530ace1fa621ca59cceb3d05740500a04fb4db58b050d76e1a74",
        "started_at": "2026-07-31T11:00:90Z",
        "finished_at": "2026-07-31T11:00:91Z",
        "status": "ok"
      },
      {
        "run_id": "run_051",
        "seed": 51,
        "config_sha256": "8a35ef5f6bc1530ace1fa621ca59cceb3d05740500a04fb4db58b050d76e1a74",
        "started_at": "2026-07-31T11:01:00Z",
        "finished_at": "2026-07-31T11:01:01Z",
        "status": "ok"
      },
      {
        "run_id": "run_052",
        "seed": 52,
        "config_sha256": "8a35ef5f6bc1530ace1fa621ca59cceb3d05740500a04fb4db58b050d76e1a74",
        "started_at": "2026-07-31T11:01:10Z",
        "finished_at": "2026-07-31T11:01:11Z",
        "status": "ok"
      },
      {
        "run_id": "run_053",
        "seed": 53,
        "config_sha256": "8a35ef5f6bc1530ace1fa621ca59cceb3d05740500a04fb4db58b050d76e1a74",
        "started_at": "2026-07-31T11:01:20Z",
        "finished_at": "2026-07-31T11:01:21Z",
        "status": "ok"
      },
      {
        "run_id": "run_054",
        "seed": 54,
        "config_sha256": "8a35ef5f6bc1530ace1fa621ca59cceb3d05740500a04fb4db58b050d76e1a74",
        "started_at": "2026-07-31T11:01:30Z",
        "finished_at": "2026-07-31T11:01:31Z",
        "status": "ok"
      },
      {
        "run_id": "run_055",
        "seed": 55,
        "config_sha256": "8a35ef5f6bc1530ace1fa621ca59cceb3d05740500a04fb4db58b050d76e1a74",
        "started_at": "2026-07-31T11:01:40Z",
        "finished_at": "2026-07-31T11:01:41Z",
        "status": "ok"
      },
      {
        "run_id": "run_056",
        "seed": 56,
        "config_sha256": "8a35ef5f6bc1530ace1fa621ca59cceb3d05740500a04fb4db58b050d76e1a74",
        "started_at": "2026-07-31T11:01:50Z",
        "finished_at": "2026-07-31T11:01:51Z",
        "status": "ok"
      },
      {
        "run_id": "run_057",
        "seed": 57,
        "config_sha256": "8a35ef5f6bc1530ace1fa621ca59cceb3d05740500a04fb4db58b050d76e1a74",
        "started_at": "2026-07-31T11:01:60Z",
        "finished_at": "2026-07-31T11:01:61Z",
        "status": "ok"
      },
      {
        "run_id": "run_058",
        "seed": 58,
        "config_sha256": "8a35ef5f6bc1530ace1fa621ca59cceb3d05740500a04fb4db58b050d76e1a74",
        "started_at": "2026-07-31T11:01:70Z",
        "finished_at": "2026-07-31T11:01:71Z",
        "status": "ok"
      },
      {
        "run_id": "run_059",
        "seed": 59,
        "config_sha256": "8a35ef5f6bc1530ace1fa621ca59cceb3d05740500a04fb4db58b050d76e1a74",
        "started_at": "2026-07-31T11:01:80Z",
        "finished_at": "2026-07-31T11:01:81Z",
        "status": "ok"
      },
      {
        "run_id": "run_060",
        "seed": 60,
        "config_sha256": "8a35ef5f6bc1530ace1fa621ca59cceb3d05740500a04fb4db58b050d76e1a74",
        "started_at": "2026-07-31T11:01:90Z",
        "finished_at": "2026-07-31T11:01:91Z",
        "status": "ok"
      }
    ],
    "failures": 0
  }
}
