{
  "artifact_id": "raw_results",
  "version": 1,
  "produced_by": {
    "role": "execution",
    "identity": "claude-code/sonnet-5",
    "provider": "claude-code",
    "model": "sonnet-5"
  },
  "produced_at": "2026-07-31T11:11:00Z",
  "inputs": [
    {
      "artifact_id": "run_manifest",
      "content_hash": "sha256:687b3c40293e2b259d30f544ddcce15668d4d6c897c81f8734c2fa8af14866dd"
    },
    {
      "artifact_id": "code_commit",
      "content_hash": "sha256:ee813c8d43306c66a7d9e65600568945b829a90aedc62724941ab180b9771464"
    }
  ],
  "content_hash": "sha256:df133a26c1fb0cf894525b2792682506fcc88a87dd33b15f8a46665306a7ace9",
  "body": {
    "payload_path": "raw_results.jsonl",
    "payload_sha256": "ad59c0bb125d02750046e27b684f9e5df478200420a20c08f174c935c69210c7",
    "records": 300,
    "run_ids": [
      "run_041",
      "run_042",
      "run_043",
      "run_044",
      "run_045",
      "run_046",
      "run_047",
      "run_048",
      "run_049",
      "run_050",
      "run_051",
      "run_052",
      "run_053",
      "run_054",
      "run_055",
      "run_056",
      "run_057",
      "run_058",
      "run_059",
      "run_060"
    ],
    "record_fields": [
      {
        "name": "run_id",
        "type": "string"
      },
      {
        "name": "seed",
        "type": "integer"
      },
      {
        "name": "snr_db",
        "type": "integer"
      },
      {
        "name": "estimator",
        "type": "string"
      },
      {
        "name": "mse",
        "type": "number"
      }
    ]
  }
}
